ID,Name,Exercise type,BodyPart,Equipment,Gender,Target,Synergist
4320,Standing Lateral Stretch (female),Stretching,Back,Body weight,Female,Latissimus Dorsi,
4321,Standing reach up back rotation stretch (female),Stretching,Back,Body weight,Female,Latissimus Dorsi,"Biceps Brachii, Deltoid Anterior, Pectoralis Major Clavicular Head, Pectoralis Major Sternal Head"
4322,Standing Side Bend (bent arm) (male),Strength,Waist,Body weight,Male,Obliques,Iliopsoas
4323,Wrist Circles (female),Strength,Forearms,Body weight,Female,"Wrist Extensors, Wrist Flexors",
4324,Standing Wheel Rollout (female),Strength,Waist,Body weight,Female,"Iliopsoas, Rectus Abdominis","Deltoid Posterior, Latissimus Dorsi, Pectoralis Major Sternal Head, Tensor Fasciae Latae, Teres Major"
4325,Peroneals Stretch (female),Stretching,Calves,Body weight,Female,"Gastrocnemius, Soleus",
4326,Dumbbell Bent Arm Pullover (female),Strength,Chest,Dumbbell,Female,,
4327,Sled Vertical Leg Press,Strength,Thighs,Sled machine,Male,,
4328,Standing Scissors,Aerobic,Plyometrics,Body weight,Male,,
4329,Push with Chair,Strength,Chest,Body weight,Male,,
4330,Reverse Crunch Kick,Strength,Waist,Body weight,Male,"Iliopsoas, Quadriceps, Rectus Abdominis","Obliques, Sartorius, Tensor Fasciae Latae"
4331,Crunch Single Leg Lift,Strength,Waist,Body weight,Male,"Iliopsoas, Rectus Abdominis","Obliques, Sartorius, Tensor Fasciae Latae"
4332,Crunch Hold,Strength,Waist,Body weight,Male,Rectus Abdominis,Obliques
4333,Bench Reverse Crunch Circle,Strength,"Hips, Waist",Body weight,Male,"Adductor Brevis, Adductor Longus, Gluteus Medius, Iliopsoas, Pectineous, Rectus Abdominis","Adductor Magnus, Obliques, Quadriceps, Sartorius"
4334,Side Plank Oblique Crunch,Strength,Waist,Body weight,Male,"Adductor Brevis, Adductor Longus, Gluteus Medius, Obliques, Pectineous","Adductor Magnus, Gracilis"
4335,Dumbbell Side Bend (VERSION 2),Strength,Waist,Dumbbell,Male,,
4336,Lever Biceps Curl,Strength,Upper Arms,Leverage machine,Male,,
4337,Dumbbell Hammer Preacher Curl (female),Strength,Forearms,Dumbbell,Female,,
4338,Barbell Spider Curl,Strength,Upper Arms,Barbell,Male,,
4339,Barbell Pullover,Strength,Back,Barbell,Male,,
4340,Barbell Wide Pullover,Strength,Back,Barbell,Male,,
4341,Dumbbell Alternate Front Raise (female),Strength,Shoulders,Dumbbell,Female,,
4342,Dumbbell Twisted Fly,Strength,Chest,Dumbbell,Male,,
4343,Dumbbell One Arm Triceps Extension (female),Strength,Upper Arms,Dumbbell,Female,,
4344,Barbell Incline Triceps Extension Skull Crusher,Strength,Upper Arms,Barbell,Male,Triceps Brachii,
4345,Cable Incline Close grip Curl,Strength,Upper Arms,Cable,Male,,
4346,Bodyweight Standing Military Press,Strength,Shoulders,Body weight,Male,,
4347,Lever Standing Leg Curl,Strength,Thighs,Leverage machine,Male,,
4348,Abdominal 4 points,Strength,Waist,Body weight,Male,,
4349,Barbell Single Leg Squat,Strength,Thighs,Barbell,Male,,
4350,Cable Lying Regular grip Curl (female),Strength,Upper Arms,Cable,Female,,
4351,Cable Incline Skull Crusher,Strength,Upper Arms,Cable,Male,,
4352,Bench Dip on floor (VERSION 2),Strength,Upper Arms,Body weight,Male,Triceps Brachii,"Deltoid Anterior, Latissimus Dorsi, Levator Scapulae, Pectoralis Major Clavicular Head, Pectoralis Major Sternal Head, Teres Major"
4353,Cable Lying Triceps Extension (with Rope),Strength,Upper Arms,Cable,Male,Triceps Brachii,
4354,Alternate Oblique Crunch,Strength,Waist,Body weight,Male,Obliques,Rectus Abdominis
4355,Cable Triceps Pushdown (V-bar) (VERSION 2),Strength,Upper Arms,Cable,Male,Triceps Brachii,
4356,Cable horizontal Pallof Press (VERSION 2),Strength,Waist,Cable,Male,,
4357,Band Biceps Curl (VERSION 2),Strength,Upper Arms,Band,Male,Biceps Brachii,"Brachialis, Brachioradialis"
4358,Band Kneeling Lat Pulldown,Strength,Back,Band,Male,Latissimus Dorsi,"Biceps Brachii, Brachialis, Brachioradialis, Deltoid Posterior, Infraspinatus, Teres Major, Teres Minor, Trapezius Lower Fibers, Trapezius Middle Fibers"
4359,Band overhead triceps extension (VERSION 2) (male),Strength,Upper Arms,Band,Male,Triceps Brachii,
4360,Bench Dip with legs on bench,Strength,Upper Arms,Body weight,Male,Triceps Brachii,"Deltoid Anterior, Latissimus Dorsi, Levator Scapulae, Pectoralis Major Clavicular Head, Pectoralis Major Sternal Head, Teres Major"
4361,Bodyweight Shrug,Strength,Back,Body weight,Male,Trapezius Upper Fibers ,Levator Scapulae
4362,Barbell Squat 2 sec Hold,Strength,Thighs,Barbell,Male,"Gluteus Maximus, Quadriceps","Adductor Magnus, Soleus"
4363,Counterbalanced Skater Squat (male),Strength,Thighs,Body weight,Male,"Gluteus Maximus, Quadriceps","Adductor Magnus, Soleus"
4364,Single Leg Dip on floor,Strength,Upper Arms,Body weight,Male,Triceps Brachii,"Deltoid Anterior, Latissimus Dorsi, Levator Scapulae, Pectoralis Major Clavicular Head, Pectoralis Major Sternal Head"
4365,Animal Resting Yoga Pose,Stretching,Stretching,Body weight,Male,,
4366,Standing Side Crunch,Aerobic,Waist,Body weight,Male,,
4367,Cable Bent-Over Reverse Grip Row,Strength,Back,Cable,Male,"Infraspinatus, Latissimus Dorsi, Teres Major, Teres Minor , Trapezius Middle Fibers, Trapezius Upper Fibers ","Brachialis, Brachioradialis, Deltoid Posterior"
4368,Cable Bent-Over Row with Rope Attachment,Strength,Back,Cable,Male,,
4369,Bodyweight Standing Biceps Curl (VERSION 2),Strength,Upper Arms,Body weight,Male,,
4370,Smith Seated Calf Raise,Strength,Calves,Smith machine,Male,,
4371,Lever Incline One Arm Chest Press (plate loaded),Strength,Chest,Leverage machine,Male,,
4372,Crocodile Yoga Pose,Stretching,Stretching,Body weight,Male,,
4373,Hanging Deadbug,Strength,Hips,Body weight,Male,"Iliopsoas, Rectus Abdominis","Quadriceps, Sartorius, Tensor Fasciae Latae"
4374,Cable Standing Alternate Low Fly,Strength,Chest,Cable,Male,,
4375,Medicine Ball Around Head Rotation,Strength,Shoulders,Medicine Ball,Male,,
4376,Handstand Walk,Aerobic,Shoulders,Body weight,Male,"Deltoid Anterior, Deltoid Lateral, Deltoid Posterior , Erector Spinae",
4377,Dumbbell Hang Clean and Jerk,Strength,Weightlifting,Dumbbell,Male,,
4378,Lever Reverse Grip High Row (plate loaded),Strength,Back,Leverage machine,Male,,
4379,Resistance Band Inverted Row,Strength,Back,Resistance Band,Male,,
4380,Standing Leg Slide with Towel,Strength,Thighs,Body weight,Male,,
4381,Legs-Up The Wall Yoga Pose,Stretching,Stretching,Body weight,Male,,
4382,Barbell Front Rack Lunge,Strength,Thighs,Barbell,Male,,
4383,Medicine Ball Step Behind Rotational Throw,Aerobic,Plyometrics,Medicine Ball,Male,,
4384,Body Saw Plank,Strength,Shoulders,Body weight,Male,"Latissimus Dorsi, Rectus Abdominis","Deltoid Anterior, Gluteus Maximus, Obliques, Pectoralis Major Clavicular Head, Pectoralis Major Sternal Head, Serratus Anterior, Tensor Fasciae Latae, Triceps Brachii"
4385,Hip Roll Plank,Strength,Waist,Body weight,Male,,
4386,Leg Extension Plank,Strength,Waist,Body weight,Male,,
4387,Prayer Squat Yoga Pose,Stretching,Stretching,Body weight,Male,,
4388,Prisoner Get-Up,Strength,Thighs,Body weight,Male,,
4389,Dumbbell Push Jerk,Strength,Weightlifting,Dumbbell,Male,,
4390,Barbell Front Rack Rear Lunge,Strength,Thighs,Barbell,Male,,
4391,Cable Low Row with Rope Attachment,Strength,Back,Cable,Male,,
4392,Rowing Boat Yoga Pose,Stretching,Stretching,Body weight,Male,,
4393,Kettlebell Russian Twist,Strength,Waist,Kettlebell,Male,,
4394,Alternate Shoulder Flexion Back to Wall,Stretching,Shoulders,Body weight,Male,,
4395,Shoulder Circle,Stretching,Back,Body weight,Male,,
4396,Kettlebell Side Bend (VERSION 2),Strength,Waist,Kettlebell,Male,,
4397,Barbell Front Rack Split Squat,Strength,Thighs,Barbell,Male,,
4398,Resistance Band Squat,Strength,Thighs,Resistance Band,Male,,
4399,Standing Seal Yoga Pose,Stretching,Stretching,Body weight,Male,,
4400,Kettlebell Step-Up,Strength,Thighs,Kettlebell,Male,,
4401,Barbell Knee Raise Step-Up,Strength,Thighs,Barbell,Male,,
4402,Straight Angle Yoga Pose,Stretching,Stretching,Body weight,Male,,
4403,Kettlebells Sumo Deadlift,Strength,Hips,Kettlebell,Male,,
4404,Swaying Palm Tree Yoga Pose,Stretching,Stretching,Body weight,Male,,
4405,The Eagle Yoga Pose,Stretching,Stretching,Body weight,Male,,
4406,Tiger Yoga Pose,Stretching,Stretching,Body weight,Male,,
4407,Tiger Tail Triceps,Stretching,Upper Arms,Body weight,Male,,
4408,Kettlebell Upright Row,Strength,Shoulders,Kettlebell,Male,Deltoid Lateral,"Biceps Brachii, Brachialis, Brachioradialis, Deltoid Anterior, Infraspinatus, Serratus Anterior, Teres Minor, Trapezius Lower Fibers, Trapezius Middle Fibers"
4409,Barbell Front Rack Walking Lunge,Aerobic,Thighs,Barbell,Male,,
4410,Warrior II Yoga Pose,Stretching,Stretching,Body weight,Male,,
4411,Barbell Seated High Front Raise,Strength,Shoulders,Barbell,Male,,
4412,Resistance Band Pullapart (Pronated at 90 Degrees),Strength,Shoulders,Resistance Band,Male,,
4414,Barbell Bench Press with Band Suspended Kettlebell,Strength,Chest,Barbell,Male,,
4415,Band Resisted Chin-Up,Strength,Back,Band,Male,,
4416,Sliding Leg Bird Dog,Strength,Back,Body weight,Male,,
4417,Sumo Squat Floor Touch,Strength,Hips,Body weight,Male,"Gluteus Maximus, Quadriceps","Adductor Magnus, Gluteus Medius, Soleus, Tensor Fasciae Latae"
4419,Lying Leg Raise (Modified),Strength,Hips,Body weight,Male,"Iliopsoas, Rectus Abdominis","Quadriceps, Sartorius"
4420,Marching On Spot,Strength,Cardio,Body weight,Male,,
4421,Cable Donkey Kickback (female),Strength,Hips,Cable,Male,Gluteus Maximus,Hamstrings
4422,EZ-bar Drag Bicep Curl,Strength,"Shoulders, Upper Arms",EZ Barbell,Male,"Biceps Brachii, Deltoid Anterior","Brachialis, Brachioradialis"
4423,Barbell Lying Close-Grip Underhand Row on Rack,Strength,Back,Barbell,Male,"Infraspinatus, Latissimus Dorsi, Teres Major, Teres Minor , Trapezius Lower Fibers, Trapezius Middle Fibers","Biceps Brachii, Brachialis, Brachioradialis, Deltoid Posterior"
4424,Barbell Lying Close-Grip Overhand Row on Rack,Strength,Back,Barbell,Male,"Infraspinatus, Latissimus Dorsi, Teres Major, Teres Minor , Trapezius Lower Fibers, Trapezius Middle Fibers","Brachialis, Brachioradialis, Deltoid Posterior"
4425,Dumbbell Lying Close-Grip Parallel Row on Rack,Strength,Back,Dumbbell,Male,"Infraspinatus, Latissimus Dorsi, Teres Major, Teres Minor , Trapezius Lower Fibers, Trapezius Middle Fibers","Biceps Brachii, Brachialis, Brachioradialis, Deltoid Posterior"
4426,Dumbbell Lying Wide-Grip Row on Rack,Strength,Back,Dumbbell,Male,"Infraspinatus, Latissimus Dorsi, Teres Major, Teres Minor , Trapezius Lower Fibers, Trapezius Middle Fibers","Brachialis, Brachioradialis, Deltoid Posterior"
4427,Lever Lying Single Leg Curl (female),Strength,Thighs,Leverage machine,Female,Hamstrings,"Gastrocnemius, Sartorius, Soleus"
4428,Power Sled Push (male),Strength,Weightlifting,Power Sled,Male,,
4429,Weighted Lying Side Neck Raise,Strength,Neck,Weighted,Male,,
4430,Weighted Side Lying Side Neck Raise,Strength,Neck,Weighted,Male,,
4431,Weighted Lying Neck Side to Side,Strength,Neck,Weighted,Male,,
4432,Weighted Lying Neck Head Twist,Strength,Neck,Weighted,Male,,
4435,High Knee Squat (VERSION 2) (male),Strength,Plyometrics,Body weight,Male,,
4436,Alternating Step Out,Strength,Plyometrics,Body weight,Male,,
4437,Alternating Hamstring Curl with Punche,Strength,Plyometrics,Body weight,Male,,
4438,Jack Step (male),Strength,Plyometrics,Body weight,Male,,
4439,Dumbbell Power Clean and Jerk,Strength,Weightlifting,Dumbbell,Male,,
4440,Kettlebell Step-Up (VERSION 2),Strength,Thighs,Kettlebell,Male,"Gluteus Maximus, Quadriceps","Adductor Magnus, Soleus"
4441,Kettlebell Front Rack Walking Lunge,Aerobic,Thighs,Kettlebell,Male,,
4442,Assisted Bulgarian Split Squat,Strength,Thighs,Body weight,Male,,
4443,Dumbbell Assisted Bulgarian Split Squat,Strength,Thighs,Dumbbell,Male,,
4444,Kettlebell Assisted Bulgarian Split Squat,Strength,Thighs,Kettlebell,Male,,
4445,Resistance Band Seated Face Pull,Strength,Shoulders,Resistance Band,Male,,
4446,Kettlebell Half Kneeling One Arm Bottoms-Up Press,Strength,Shoulders,Kettlebell,Male,,
4447,Resistance Band Elevated Glute Bridge,Strength,Hips,Resistance Band,Male,,
4448,Barbell Resistance Band Hip Thrust,Strength,Hips,Barbell,Male,,
4449,Dumbbell Hang Clean,Strength,Weightlifting,Dumbbell,Male,,
4450,Suspender Wide Grip Inverted Row,Strength,Back,Suspension,Male,"Infraspinatus, Latissimus Dorsi, Teres Major, Teres Minor , Trapezius Lower Fibers, Trapezius Middle Fibers","Brachialis, Brachioradialis, Deltoid Posterior"
4451,Suspender Wide Grip Inverted Row on floor (female),Strength,Back,Suspension,Female,"Infraspinatus, Latissimus Dorsi, Teres Major, Teres Minor , Trapezius Lower Fibers, Trapezius Middle Fibers","Brachialis, Brachioradialis, Deltoid Posterior"
4452,Band Bent Over Wide Grip Row (male),Strength,Back,Band,Male,"Infraspinatus, Latissimus Dorsi, Teres Major, Teres Minor , Trapezius Lower Fibers, Trapezius Middle Fibers","Brachialis, Brachioradialis, Deltoid Posterior"
4453,Band One Arm Standing Wide Grip Low Row,Strength,Back,Band,Male,"Infraspinatus, Latissimus Dorsi, Teres Major, Teres Minor , Trapezius Lower Fibers, Trapezius Middle Fibers","Brachialis, Brachioradialis, Deltoid Posterior"
4454,Band Seated Wide Grip Row (female),Strength,Back,Band,Female,"Infraspinatus, Latissimus Dorsi, Teres Major, Teres Minor , Trapezius Lower Fibers, Trapezius Middle Fibers","Brachialis, Brachioradialis, Deltoid Posterior"
4455,45 degrees Back Extension,Strength,Hips,Body weight,Male,Erector Spinae,
4456,Glute Ham Raise (VERSION 2),Strength,Thighs,Body weight,Male,Hamstrings,"Gastrocnemius, Gluteus Maximus"
4457,Dumbbell Side Bridge with Bent Leg (male),Strength,Waist,Dumbbell,Male,Obliques,
4458,Side Bridge with Straight Legs (female),Strength,Waist,Body weight,Female,Obliques,
4459,Lying Ab Press (male),Strength,Waist,Body weight,Male,Rectus Abdominis,Iliopsoas
4460,Lying Ab Press (female),Strength,Waist,Body weight,Female,Rectus Abdominis,Iliopsoas
4461,Side Bridge with Bent Leg (female),Strength,Waist,Body weight,Female,Obliques,
4462,Roll Ball Foot,Stretching,Calves,Rollball,Male,,
4463,Roll Ball Peroneus,Stretching,Calves,Rollball,Male,,
4464,Roll Ball Tibialis Anterior,Stretching,Calves,Rollball,Male,,
4465,Roll Ball Calf,Stretching,Calves,Rollball,Male,,
4466,Roll Ball Popliteal,Stretching,Thighs,Rollball,Male,,
4467,Roll Ball Tibialis Posterior,Stretching,Calves,Rollball,Male,,
4468,Roll Ball Rectus Femoris,Stretching,Thighs,Rollball,Male,,
4469,Roll Ball Lateral Vastus,Stretching,Thighs,Rollball,Male,,
4470,Roll Ball Adductors,Stretching,Hips,Rollball,Male,,
4471,Roll Ball Tensor Fasciae Latae,Stretching,Hips,Rollball,Male,Tensor Fasciae Latae,
4472,Roll Ball Gluteus Medius,Stretching,Hips,Rollball,Male,,
4473,Roll Ball Piriformis,Stretching,Hips,Rollball,Male,,
4474,Roll Ball Piriformis (VERSION 2),Stretching,Hips,Rollball,Male,,
4475,Roll Ball Iliospsoas,Stretching,Hips,Rollball,Male,Iliopsoas,
4476,Roll Ball Psoas - Abdominal Region,Stretching,Hips,Rollball,Male,,
4477,Roll Ball Iliacus - Abdominal Region,Stretching,Hips,Rollball,Male,,
4478,Roll Ball External Oblique,Stretching,Waist,Rollball,Male,,
4479,Roll Ball Rectus Abdominis,Stretching,Waist,Rollball,Male,,
4480,Roll Ball Erector Spinae,Stretching,Hips,Rollball,Male,,
4481,Roll Ball Lumbar - Diagonal,Stretching,Hips,Rollball,Male,,
4482,Roll Ball Diaphragm,Stretching,Waist,Rollball,Male,,
4483,Roll Ball Pectoralis Major - Sternal,Stretching,Chest,Rollball,Male,,
4484,Roll Ball Pectoralis Major - Clavicular,Stretching,Chest,Rollball,Male,,
4485,Roll Ball Infraspinatus,Stretching,Back,Rollball,Male,,
4486,Roll Ball Infraspinatus (VERSION 2),Stretching,Back,Rollball,Male,,
4487,Roll Ball Scapula Levator,Stretching,Back,Rollball,Male,,
4488,Roll Ball Scapula Levator (VERSION 2),Stretching,Back,Rollball,Male,,
4489,Roll Ball Rhomboid,Stretching,Back,Rollball,Male,,
4490,Roll Ball Trapezius Upper,Stretching,Back,Rollball,Male,,
4491,Roll Ball Trapezius Lower,Stretching,Back,Rollball,Male,,
4492,Roll Ball Trapezius Lower (VERSION 2),Stretching,Back,Rollball,Male,,
4493,Roll Ball Latissimus Dorsi,Stretching,Back,Rollball,Male,,
4494,Roll Ball Forearm Flexors,Stretching,Forearms,Rollball,Male,,
4495,Roll Ball Forearm Supinator,Stretching,Forearms,Rollball,Male,,
4496,Roll Ball Forearm Extensors,Stretching,Forearms,Rollball,Male,,
4497,Roll Ball Forearm Pronator,Stretching,Forearms,Rollball,Male,,
4498,Roll Ball Bicep Brachii,Stretching,Upper Arms,Rollball,Male,,
4499,Bodyweight Full Squat with Overhead Press,Strength,Plyometrics,Body weight,Male,,
4500,Bodyweight Front Plank to Downward Dog,Aerobic,Plyometrics,Body weight,Male,,
4506,Kneeling Shoulder Tap,Strength,Chest,Body weight,Male,"Pectoralis Major Clavicular Head, Pectoralis Major Sternal Head","Biceps Brachii, Brachialis, Brachioradialis, Deltoid Anterior"
4508,Butterfly Yoga Pose (female),Stretching,Hips,Body weight,Female,"Adductor Brevis, Adductor Longus, Adductor Magnus, Gluteus Maximus, Gluteus Medius, Gluteus Minimus, Gracilis, Pectineous",
4509,Chin-to-chest Stretch (male),Stretching,Waist,Body weight,Male,Rectus Abdominis,
4510,Calves Stretch (male),Stretching,Calves,Body weight,Male,"Gastrocnemius, Soleus",
4511,Bridge Pose Setu Bandhasana (male),Stretching,Yoga,Body weight,Male,"Adductor Magnus, Gluteus Maximus, Hamstrings, Latissimus Dorsi, Pectoralis Major Sternal Head, Quadriceps, Teres Major, Triceps Brachii",
4512,Adductor Stretch (male),Stretching,Hips,Body weight,Male,"Adductor Brevis, Adductor Longus, Adductor Magnus, Gracilis, Pectineous",
4513,All Fours Squad Stretch (female),Stretching,"Hips, Thighs",Body weight,Male,"Adductor Magnus, Gluteus Maximus, Hamstrings, Iliopsoas, Quadriceps",
4514,Above Head Chest Stretch (female),Stretching,Chest,Body weight,Female,"Deltoid Anterior, Pectoralis Major Clavicular Head, Pectoralis Major Sternal Head",
4515,Back Pec Stretch,Stretching,"Back, Chest",Body weight,Female,"Latissimus Dorsi, Pectoralis Major Sternal Head, Teres Major",
4516,Band Warm-up Shoulder Stretch (male),Stretching,Chest,Band,Male,"Deltoid Anterior, Deltoid Lateral, Deltoid Posterior , Infraspinatus, Pectoralis Major Clavicular Head, Pectoralis Major Sternal Head, Teres Minor , Trapezius Middle Fibers",
4517,Kettlebell Thruster (female),Strength,Weightlifting,Kettlebell,Female,,
4518,Kettlebell Single Arm Thruster (female),Strength,Weightlifting,Kettlebell,Female,,
4519,Kettlebell Windmill (female),Strength,Waist,Kettlebell,Female,,
4520,Kettlebell Double Windmill (female),Strength,Waist,Kettlebell,Female,,
4521,Kettlebell Press-Up (female),Strength,Chest,Kettlebell,Female,,
4522,Kettlebell Sit-Up (female),Strength,Chest,Kettlebell,Female,,
4523,Kettlebell Single Leg Deadlift (female),Strength,Hips,Kettlebell,Female,,
4524,Kettlebell Side Squat Step (female),Strength,Thighs,Kettlebell,Female,,
4525,Kettlebell Forward Lunge (female),Strength,Thighs,Kettlebell,Female,,
4526,Kettlebell Side Lunge (female),Strength,Thighs,Kettlebell,Female,,
4527,Kettlebell Single Arm Swing (female),Strength,Hips,Kettlebell,Female,,
4528,Kettlebell Farmers Walk (female),Aerobic,Plyometrics,Kettlebell,Female,,
4529,Kettlebell Unilateral Farmers Walk (female),Aerobic,Plyometrics,Kettlebell,Female,,
4530,Kettlebell Single Arm Clean (female),Strength,Weightlifting,Kettlebell,Female,,
4531,Kettlebell Single Arm Clean and Press (female),Strength,Weightlifting,Kettlebell,Female,,
4532,Kettlebell Snatch (female),Strength,Weightlifting,Kettlebell,Female,,
4533,Kettlebell Forward Lunge and Press (female),Strength,Thighs,Kettlebell,Female,,
4534,Kettlebell Standing Slingshots (female),Strength,Shoulders,Kettlebell,Female,,
4535,Kettlebell Single Arm Sit-Up (female),Strength,Chest,Kettlebell,Female,,
4536,Kettlebell Rear Delt Row (female),Strength,Back,Kettlebell,Female,,
4537,Kettlebell Bent-Over Row (female),Strength,Back,Kettlebell,Female,,
4538,Kettlebell Bent Arm Pullover with Knees Bent (female),Strength,Back,Kettlebell,Female,,
4539,Diamond Press,Strength,"Back, Chest",Body weight,Male,"Erector Spinae, Pectoralis Major Clavicular Head, Pectoralis Major Sternal Head",Deltoid Anterior
4540,Dumbbell One Arm Thruster,Strength,"Hips, Shoulders, Thighs",Dumbbell,Male,,
4541,Kettlebell One Arm Thruster,Strength,"Hips, Shoulders, Thighs",Kettlebell,Male,,
4542,Kettlebell Clean and Jerk,Strength,"Hips, Shoulders, Thighs",Kettlebell,Male,,
4543,Kettlebell One Arm Clean,Strength,"Hips, Shoulders, Thighs",Kettlebell,Male,,
4544,Band Incline Bench Press,Strength,Chest,Band,Male,,
4545,Cable Bent-Over Single Arm Kickback,Strength,Upper Arms,Cable,Male,,
4546,Smith Drag Curl,Strength,Upper Arms,Smith machine,Male,,
4547,Good Morning Squat,Strength,Hips,Body weight,Male,Hamstrings,"Adductor Magnus, Gluteus Maximus"
4548,Burpee Squat,Aerobic,Plyometrics,Body weight,Male,,
4552,Diagonal Lunge,Strength,Plyometrics,Body weight,Male,,
4553,Thoracic Bridge,Stretching,Stretching,Body weight,Male,"Gastrocnemius, Gluteus Maximus, Hamstrings, Infraspinatus, Latissimus Dorsi, Obliques, Soleus, Teres Major, Teres Minor , Trapezius Lower Fibers, Trapezius Middle Fibers",
4554,Seated Glute Stretch (VERSION 2),Stretching,Hips,Body weight,Male,,
4555,Dynamic 90-90 Hip Twist,Stretching,"Hips, Waist",Body weight,Male,,
4556,Push Through Reach,Stretching,Stretching,Body weight,Male,,
4557,Couch Stretch,Stretching,"Thighs, Waist",Body weight,Male,,
4558,Child to Cobra Pose,Stretching,Stretching,Body weight,Male,,
4559,Kneeling Lat Stretch on Bench,Stretching,"Back, Upper Arms",Body weight,Male,,
4560,Body Extension,Stretching,"Hips, Thighs, Waist",Body weight,Male,,
4561,Bodyweight Elevanted Heel Squat,Strength,"Calves, Hips, Thighs",Body weight,Male,,
4562,Dumbbell Cossack Squats (male),Strength,"Hips, Thighs",Dumbbell,Male,,
4563,Dumbbell Squat Hold Calf Raise,Strength,"Calves, Hips, Thighs",Dumbbell,Male,,
4564,Dumbbell Squat Lunges Jump Complex,Aerobic,"Hips, Thighs",Dumbbell,Male,,
4565,Dumbbell Step-up with Knee Raise,Strength,Hips,Dumbbell,Male,"Gluteus Maximus, Quadriceps","Adductor Magnus, Soleus"
4566,Cable Neutral Grip Kickback,Strength,Upper Arms,Cable,Male,Triceps Brachii,
4567,Cable Bent-Over Single Arm Neutral Grip Kickback with Rope Attachment,Strength,Upper Arms,Cable,Male,,
4568,Resistance Band Pull Apart,Strength,Shoulders,Resistance Band,Male,Deltoid Posterior ,"Infraspinatus, Teres Minor, Trapezius Lower Fibers, Trapezius Middle Fibers"
4569,Resistance Band One Arm Bent Over Row,Strength,Back,Resistance Band,Male,"Infraspinatus, Latissimus Dorsi, Teres Major, Teres Minor , Trapezius Lower Fibers, Trapezius Middle Fibers","Brachialis, Brachioradialis, Deltoid Posterior"
4570,Resistance Band Bent Over Neutral Grip Row,Strength,Back,Resistance Band,Male,"Infraspinatus, Latissimus Dorsi, Teres Major, Teres Minor , Trapezius Lower Fibers, Trapezius Middle Fibers","Biceps Brachii, Brachialis, Brachioradialis, Deltoid Posterior"
4571,Resistance Band Push-Up,Strength,Chest,Resistance Band,Male,"Pectoralis Major Clavicular Head, Pectoralis Major Sternal Head","Deltoid Posterior, Triceps Brachii"
4572,Dumbbell Half Kneeling Lift and Chop,Strength,Waist,Dumbbell,Male,,
4573,Band Half Kneeling Chop,Strength,Waist,Band,Male,Obliques,"Infraspinatus, Latissimus Dorsi, Rectus Abdominis, Teres Major, Teres Minor, Trapezius Lower Fibers, Trapezius Middle Fibers"
4574,Dumbbell Standing Biceps Curl to Shoulder Press (male),Strength,"Shoulders, Upper Arms",Dumbbell,Male,,
4575,Band Standing Single Arm Row,Strength,Back,Band,Male,,
4576,Band Standing Straight Arm Pulldown,Strength,Back,Band,Male,,
4577,Dumbbell Half Kneeling Military Press,Strength,Shoulders,Dumbbell,Male,,
4578,Cable Bent-Over Neutral Grip Kickback with Rope Attachment,Strength,Upper Arms,Cable,Male,,
4579,Bodyweight Step-up on Stepbox,Strength,Thighs,Body weight,Male,"Gluteus Maximus, Quadriceps","Adductor Magnus, Soleus"
4580,Cat Cow Stretch,Stretching,Waist,Body weight,Male,"Erector Spinae, Obliques, Rectus Abdominis",
4581,Boxing Block,Aerobic,Plyometrics,Body weight,Male,,
4582,Boxing Jab (with boxing bag),Aerobic,Plyometrics,Body weight,Male,,
4583,Boxing Right Cross (with boxing bag),Aerobic,Plyometrics,Body weight,Male,,
4584,Boxing Right Hook (with boxing bag),Aerobic,Plyometrics,Body weight,Male,,
4585,Front Groin Kick Kickboxing (with boxing bag),Aerobic,Plyometrics,Body weight,Male,,
4586,Front Kick Kickboxing (with boxing bag),Aerobic,Plyometrics,Body weight,Male,,
4587,Front Snap Kick Kickboxing (with boxing bag),Aerobic,Plyometrics,Body weight,Male,,
4588,Hook Kick Kickboxing (with boxing bag),Aerobic,Plyometrics,Body weight,Male,,
4589,Boxing Jab (with partner),Aerobic,Plyometrics,Body weight,Male,,
4590,Boxing Left Uppercut (with partner),Aerobic,Plyometrics,Body weight,Male,,
4591,Boxing Right Cross (with partner),Aerobic,Plyometrics,Body weight,Male,,
4592,Boxing Right Hook (with partner),Aerobic,Plyometrics,Body weight,Male,,
4593,Boxing Right Uppercut (with partner),Aerobic,Plyometrics,Body weight,Male,,
4594,Front Kick Kickboxing (with partner),Aerobic,Plyometrics,Body weight,Male,,
4595,Front Knee Kick Kickboxing (with partner),Aerobic,Plyometrics,Body weight,Male,,
4596,Front Snap Kick Kickboxing (with partner),Aerobic,Plyometrics,Body weight,Male,,
4597,Hook Kick Kickboxing (with partner),Aerobic,Plyometrics,Body weight,Male,,
4598,Roll Tensor Fasciae Latae,Stretching,Hips,Roll,Male,Tensor Fasciae Latae,
4599,Roll Iliospsoas,Stretching,Hips,Roll,Male,Iliopsoas,
4600,Roll Ball Lower Back,Stretching,Hips,Rollball,Male,Erector Spinae,
4601,Open Book Stretch,Stretching,Waist,Body weight,Male,"Deltoid Anterior, Obliques, Pectoralis Major Clavicular Head, Pectoralis Major Sternal Head, Rectus Abdominis",
4602,PVC External Rotation,Strength,Back,Body weight,Male,"Infraspinatus, Subscapularis, Teres Minor ",
4603,PVC Front Rack Stretch,Stretching,Back,Body weight,Male,"Infraspinatus, Subscapularis, Teres Minor ",
4604,PVC Good Morning,Strength,Hips,Stick,Male,Hamstrings,"Adductor Magnus, Gluteus Maximus"
4605,PVC Hip Hinge,Strength,Hips,Stick,Male,Gluteus Maximus,Hamstrings
